{
  "id": "proof-summary-repo-baseline-shape-example",
  "schema_version": "0.1.0",
  "artifact_role": "untrusted_shape_example",
  "profile": "repo_baseline_structural",
  "result": "cannot_verify",
  "trust_scope": "untrusted_shape_only",
  "generated_at": "1970-01-01T00:00:00Z",
  "generated_by": {
    "tool": "sdp-trace",
    "version": "0.1.0",
    "invocation": "sdp-trace validate-fixtures examples --example",
    "source_subject_ref": "source:0000000000000000000000000000000000000000",
    "gate_set_digest": "0000000000000000000000000000000000000000000000000000000000000000"
  },
  "source_subject": {
    "id": "source:0000000000000000000000000000000000000000",
    "type": "git_commit_v1",
    "commit": "0000000000000000000000000000000000000000",
    "dirty": true,
    "dirty_allowed": true
  },
  "spec_subject": {
    "id": "spec:block-07-minimum-trust-kernel",
    "path": "specs/001-sdp-trace-time-series-evidence-substrate/blocks/07-minimum-trust-kernel.md",
    "digest_algorithm": "sha256",
    "digest": "0000000000000000000000000000000000000000000000000000000000000000"
  },
  "gate_set_subject": {
    "id": "gate-set:repo-baseline-shape-example",
    "digest_algorithm": "sha256",
    "digest": "0000000000000000000000000000000000000000000000000000000000000000",
    "files": [
      {
        "path": "schema/proof-summary.schema.json",
        "sha256": "0000000000000000000000000000000000000000000000000000000000000000"
      }
    ]
  },
  "claims": [
    "shape example only",
    "external production trust not assessed",
    "no checked-in proof authority claimed"
  ],
  "states": [
    {
      "id": "live_verifier_replay",
      "result": "cannot_verify",
      "required": true,
      "method": "sdp-trace validate-fixtures examples --example",
      "reason": "This fixture is an untrusted shape example and is not live verifier output."
    }
  ],
  "failures": [],
  "not_assessed": [
    {
      "id": "external_production_trust",
      "result": "not_assessed",
      "required": false,
      "method": "external production trust profile",
      "reason": "No external attestation, protected source, transparency, customer audit, or approval evidence is part of this shape example."
    }
  ]
}
